"No.","Time","Source","Destination","Protocol","Length","Info"
"1","0.000000000","192.168.87.1","224.0.0.1","IGMPv3","60","Membership Query, general"
"2","0.004365039","fe80::1eef:3ff:fe0c:795c","ff02::1","ICMPv6","86","Multicast Listener Query"
"3","0.007992290","fe80::a00:27ff:fec2:e641","ff02::fb","ICMPv6","86","Multicast Listener Report"
"4","0.010846310","fe80::a00:27ff:fec2:e641","ff02::1:ffc2:e641","ICMPv6","86","Multicast Listener Report"
"5","0.013841845","fe80::a00:27ff:fe3b:8380","ff02::1:ff3b:8380","ICMPv6","86","Multicast Listener Report"
"6","0.315105238","192.168.87.9","224.0.0.22","IGMPv3","60","Membership Report / Join group 224.0.0.252 for any sources"
"7","0.315105363","fe80::7881:93e9:628e:33f9","ff02::1:ff8e:33f9","ICMPv6","86","Multicast Listener Report"
"8","0.315105387","fe80::7881:93e9:628e:33f9","ff02::1:3","ICMPv6","86","Multicast Listener Report"
"9","0.315105419","fe80::7881:93e9:628e:33f9","ff02::c","ICMPv6","86","Multicast Listener Report"
"10","2.315033610","192.168.87.9","224.0.0.22","IGMPv3","60","Membership Report / Join group 239.255.102.18 for any sources"
"11","2.815048750","192.168.87.9","224.0.0.22","IGMPv3","60","Membership Report / Join group 239.255.255.250 for any sources"
"12","5.087305168","192.168.87.19","224.0.0.22","IGMPv3","54","Membership Report / Join group 224.0.0.251 for any sources"
"13","6.411881032","192.168.87.1","224.0.0.1","IGMPv3","60","Membership Query, general"
"14","6.814817453","192.168.87.9","224.0.0.22","IGMPv3","60","Membership Report / Join group 239.255.102.18 for any sources"
"15","7.814869787","192.168.87.9","224.0.0.22","IGMPv3","60","Membership Report / Join group 224.0.0.251 for any sources"
"16","8.634263649","192.168.87.13","192.168.87.17","TCP","74","44536  >  80 [SYN] Seq=0 Win=64240 Len=0 MSS=1460 SACK_PERM TSval=3244791061 TSecr=0 WS=128"
"17","8.635826272","192.168.87.13","192.168.87.17","TCP","74","44538  >  80 [SYN] Seq=0 Win=64240 Len=0 MSS=1460 SACK_PERM TSval=3244791062 TSecr=0 WS=128"
"18","8.641983270","192.168.87.13","192.168.87.17","TCP","74","44540  >  80 [SYN] Seq=0 Win=64240 Len=0 MSS=1460 SACK_PERM TSval=3244791069 TSecr=0 WS=128"
"19","8.645815695","192.168.87.13","192.168.87.17","TCP","74","44556  >  80 [SYN] Seq=0 Win=64240 Len=0 MSS=1460 SACK_PERM TSval=3244791072 TSecr=0 WS=128"
"20","8.654907229","192.168.87.13","192.168.87.17","TCP","74","44570  >  80 [SYN] Seq=0 Win=64240 Len=0 MSS=1460 SACK_PERM TSval=3244791082 TSecr=0 WS=128"
"21","8.657659817","192.168.87.13","192.168.87.17","TCP","74","44582  >  80 [SYN] Seq=0 Win=64240 Len=0 MSS=1460 SACK_PERM TSval=3244791084 TSecr=0 WS=128"
"22","8.661830626","192.168.87.13","192.168.87.17","TCP","74","44588  >  80 [SYN] Seq=0 Win=64240 Len=0 MSS=1460 SACK_PERM TSval=3244791089 TSecr=0 WS=128"
"23","8.666123263","192.168.87.13","192.168.87.17","TCP","74","44590  >  80 [SYN] Seq=0 Win=64240 Len=0 MSS=1460 SACK_PERM TSval=3244791093 TSecr=0 WS=128"
"24","8.669230731","192.168.87.13","192.168.87.17","TCP","74","44604  >  80 [SYN] Seq=0 Win=64240 Len=0 MSS=1460 SACK_PERM TSval=3244791096 TSecr=0 WS=128"
"25","8.673260819","192.168.87.13","192.168.87.17","TCP","74","44624  >  80 [SYN] Seq=0 Win=64240 Len=0 MSS=1460 SACK_PERM TSval=3244791100 TSecr=0 WS=128"
"26","8.678082764","192.168.87.13","192.168.87.17","TCP","74","44626  >  80 [SYN] Seq=0 Win=64240 Len=0 MSS=1460 SACK_PERM TSval=3244791104 TSecr=0 WS=128"
"27","8.681750567","192.168.87.13","192.168.87.17","TCP","74","44644  >  80 [SYN] Seq=0 Win=64240 Len=0 MSS=1460 SACK_PERM TSval=3244791108 TSecr=0 WS=128"
"28","8.685170054","192.168.87.13","192.168.87.17","TCP","74","44660  >  80 [SYN] Seq=0 Win=64240 Len=0 MSS=1460 SACK_PERM TSval=3244791112 TSecr=0 WS=128"
"29","8.689299283","192.168.87.13","192.168.87.17","TCP","74","44666  >  80 [SYN] Seq=0 Win=64240 Len=0 MSS=1460 SACK_PERM TSval=3244791116 TSecr=0 WS=128"
"30","8.693060101","192.168.87.13","192.168.87.17","TCP","74","44682  >  80 [SYN] Seq=0 Win=64240 Len=0 MSS=1460 SACK_PERM TSval=3244791120 TSecr=0 WS=128"
"31","8.696850086","192.168.87.13","192.168.87.17","TCP","74","44696  >  80 [SYN] Seq=0 Win=64240 Len=0 MSS=1460 SACK_PERM TSval=3244791123 TSecr=0 WS=128"
"32","8.701027909","192.168.87.13","192.168.87.17","TCP","74","44708  >  80 [SYN] Seq=0 Win=64240 Len=0 MSS=1460 SACK_PERM TSval=3244791128 TSecr=0 WS=128"
"33","8.705027978","192.168.87.13","192.168.87.17","TCP","74","44716  >  80 [SYN] Seq=0 Win=64240 Len=0 MSS=1460 SACK_PERM TSval=3244791132 TSecr=0 WS=128"
"34","8.709076489","192.168.87.13","192.168.87.17","TCP","74","44726  >  80 [SYN] Seq=0 Win=64240 Len=0 MSS=1460 SACK_PERM TSval=3244791135 TSecr=0 WS=128"
"35","8.712277309","192.168.87.13","192.168.87.17","TCP","74","44734  >  80 [SYN] Seq=0 Win=64240 Len=0 MSS=1460 SACK_PERM TSval=3244791139 TSecr=0 WS=128"
"36","8.717074927","192.168.87.13","192.168.87.17","TCP","74","44738  >  80 [SYN] Seq=0 Win=64240 Len=0 MSS=1460 SACK_PERM TSval=3244791143 TSecr=0 WS=128"
"37","8.721046064","192.168.87.13","192.168.87.17","TCP","74","44746  >  80 [SYN] Seq=0 Win=64240 Len=0 MSS=1460 SACK_PERM TSval=3244791148 TSecr=0 WS=128"
"38","8.725125600","192.168.87.13","192.168.87.17","TCP","74","44750  >  80 [SYN] Seq=0 Win=64240 Len=0 MSS=1460 SACK_PERM TSval=3244791151 TSecr=0 WS=128"
"39","8.729239529","192.168.87.13","192.168.87.17","TCP","74","44768  >  80 [SYN] Seq=0 Win=64240 Len=0 MSS=1460 SACK_PERM TSval=3244791156 TSecr=0 WS=128"
"40","8.733883120","192.168.87.13","192.168.87.17","TCP","74","44778  >  80 [SYN] Seq=0 Win=64240 Len=0 MSS=1460 SACK_PERM TSval=3244791160 TSecr=0 WS=128"
"41","8.737219995","192.168.87.13","192.168.87.17","TCP","74","44780  >  80 [SYN] Seq=0 Win=64240 Len=0 MSS=1460 SACK_PERM TSval=3244791164 TSecr=0 WS=128"
"42","8.741069980","192.168.87.13","192.168.87.17","TCP","74","44794  >  80 [SYN] Seq=0 Win=64240 Len=0 MSS=1460 SACK_PERM TSval=3244791167 TSecr=0 WS=128"
"43","8.744234541","192.168.87.13","192.168.87.17","TCP","74","44796  >  80 [SYN] Seq=0 Win=64240 Len=0 MSS=1460 SACK_PERM TSval=3244791171 TSecr=0 WS=128"
"44","8.747811526","192.168.87.13","192.168.87.17","TCP","74","44808  >  80 [SYN] Seq=0 Win=64240 Len=0 MSS=1460 SACK_PERM TSval=3244791174 TSecr=0 WS=128"
"45","8.750353347","192.168.87.13","192.168.87.17","TCP","74","44820  >  80 [SYN] Seq=0 Win=64240 Len=0 MSS=1460 SACK_PERM TSval=3244791177 TSecr=0 WS=128"
"46","8.754339166","192.168.87.13","192.168.87.17","TCP","74","44832  >  80 [SYN] Seq=0 Win=64240 Len=0 MSS=1460 SACK_PERM TSval=3244791181 TSecr=0 WS=128"
"47","8.758079449","192.168.87.13","192.168.87.17","TCP","74","44842  >  80 [SYN] Seq=0 Win=64240 Len=0 MSS=1460 SACK_PERM TSval=3244791185 TSecr=0 WS=128"
"48","8.763271451","192.168.87.13","192.168.87.17","TCP","74","44854  >  80 [SYN] Seq=0 Win=64240 Len=0 MSS=1460 SACK_PERM TSval=3244791190 TSecr=0 WS=128"
"49","8.773064592","192.168.87.13","192.168.87.17","TCP","74","44868  >  80 [SYN] Seq=0 Win=64240 Len=0 MSS=1460 SACK_PERM TSval=3244791200 TSecr=0 WS=128"
"50","8.798435868","192.168.87.13","192.168.87.17","TCP","74","44874  >  80 [SYN] Seq=0 Win=64240 Len=0 MSS=1460 SACK_PERM TSval=3244791225 TSecr=0 WS=128"
"51","8.801976090","192.168.87.13","192.168.87.17","TCP","74","44884  >  80 [SYN] Seq=0 Win=64240 Len=0 MSS=1460 SACK_PERM TSval=3244791229 TSecr=0 WS=128"
"52","8.805350833","192.168.87.13","192.168.87.17","TCP","74","44892  >  80 [SYN] Seq=0 Win=64240 Len=0 MSS=1460 SACK_PERM TSval=3244791232 TSecr=0 WS=128"
"53","8.809086648","192.168.87.13","192.168.87.17","TCP","74","44904  >  80 [SYN] Seq=0 Win=64240 Len=0 MSS=1460 SACK_PERM TSval=3244791236 TSecr=0 WS=128"
"54","8.812014307","192.168.87.13","192.168.87.17","TCP","74","44906  >  80 [SYN] Seq=0 Win=64240 Len=0 MSS=1460 SACK_PERM TSval=3244791239 TSecr=0 WS=128"
"55","8.815094545","192.168.87.13","192.168.87.17","TCP","74","44910  >  80 [SYN] Seq=0 Win=64240 Len=0 MSS=1460 SACK_PERM TSval=3244791242 TSecr=0 WS=128"
"56","8.818019137","192.168.87.13","192.168.87.17","TCP","74","44926  >  80 [SYN] Seq=0 Win=64240 Len=0 MSS=1460 SACK_PERM TSval=3244791245 TSecr=0 WS=128"
"57","8.821897752","192.168.87.13","192.168.87.17","TCP","74","44932  >  80 [SYN] Seq=0 Win=64240 Len=0 MSS=1460 SACK_PERM TSval=3244791248 TSecr=0 WS=128"
"58","8.824775367","192.168.87.13","192.168.87.17","TCP","74","44946  >  80 [SYN] Seq=0 Win=64240 Len=0 MSS=1460 SACK_PERM TSval=3244791251 TSecr=0 WS=128"
"59","8.827820496","192.168.87.13","192.168.87.17","TCP","74","44956  >  80 [SYN] Seq=0 Win=64240 Len=0 MSS=1460 SACK_PERM TSval=3244791254 TSecr=0 WS=128"
"60","8.831852287","192.168.87.13","192.168.87.17","TCP","74","44966  >  80 [SYN] Seq=0 Win=64240 Len=0 MSS=1460 SACK_PERM TSval=3244791258 TSecr=0 WS=128"
"61","8.834041031","192.168.87.13","192.168.87.17","TCP","74","44972  >  80 [SYN] Seq=0 Win=64240 Len=0 MSS=1460 SACK_PERM TSval=3244791261 TSecr=0 WS=128"
"62","8.837841794","192.168.87.13","192.168.87.17","TCP","74","44980  >  80 [SYN] Seq=0 Win=64240 Len=0 MSS=1460 SACK_PERM TSval=3244791265 TSecr=0 WS=128"
"63","8.840855166","192.168.87.13","192.168.87.17","TCP","74","44984  >  80 [SYN] Seq=0 Win=64240 Len=0 MSS=1460 SACK_PERM TSval=3244791268 TSecr=0 WS=128"
"64","8.844209974","192.168.87.13","192.168.87.17","TCP","74","44994  >  80 [SYN] Seq=0 Win=64240 Len=0 MSS=1460 SACK_PERM TSval=3244791271 TSecr=0 WS=128"
"65","8.848123348","192.168.87.13","192.168.87.17","TCP","74","45002  >  80 [SYN] Seq=0 Win=64240 Len=0 MSS=1460 SACK_PERM TSval=3244791275 TSecr=0 WS=128"
"66","8.851462293","192.168.87.13","192.168.87.17","TCP","74","45010  >  80 [SYN] Seq=0 Win=64240 Len=0 MSS=1460 SACK_PERM TSval=3244791278 TSecr=0 WS=128"
"67","8.854362912","192.168.87.13","192.168.87.17","TCP","74","45014  >  80 [SYN] Seq=0 Win=64240 Len=0 MSS=1460 SACK_PERM TSval=3244791281 TSecr=0 WS=128"
"68","8.857425680","192.168.87.13","192.168.87.17","TCP","74","45016  >  80 [SYN] Seq=0 Win=64240 Len=0 MSS=1460 SACK_PERM TSval=3244791284 TSecr=0 WS=128"
"69","8.860180066","192.168.87.13","192.168.87.17","TCP","74","45032  >  80 [SYN] Seq=0 Win=64240 Len=0 MSS=1460 SACK_PERM TSval=3244791287 TSecr=0 WS=128"
"70","8.864032598","192.168.87.13","192.168.87.17","TCP","74","45040  >  80 [SYN] Seq=0 Win=64240 Len=0 MSS=1460 SACK_PERM TSval=3244791291 TSecr=0 WS=128"
"71","8.866310474","192.168.87.13","192.168.87.17","TCP","74","45048  >  80 [SYN] Seq=0 Win=64240 Len=0 MSS=1460 SACK_PERM TSval=3244791293 TSecr=0 WS=128"
"72","8.870165995","192.168.87.13","192.168.87.17","TCP","74","45056  >  80 [SYN] Seq=0 Win=64240 Len=0 MSS=1460 SACK_PERM TSval=3244791297 TSecr=0 WS=128"
"73","8.873917995","192.168.87.13","192.168.87.17","TCP","74","45072  >  80 [SYN] Seq=0 Win=64240 Len=0 MSS=1460 SACK_PERM TSval=3244791300 TSecr=0 WS=128"
"74","8.876974376","192.168.87.13","192.168.87.17","TCP","74","45078  >  80 [SYN] Seq=0 Win=64240 Len=0 MSS=1460 SACK_PERM TSval=3244791304 TSecr=0 WS=128"
"75","8.879964256","192.168.87.13","192.168.87.17","TCP","74","45092  >  80 [SYN] Seq=0 Win=64240 Len=0 MSS=1460 SACK_PERM TSval=3244791307 TSecr=0 WS=128"
"76","8.882823134","192.168.87.13","192.168.87.17","TCP","74","45104  >  80 [SYN] Seq=0 Win=64240 Len=0 MSS=1460 SACK_PERM TSval=3244791309 TSecr=0 WS=128"
"77","8.886349969","192.168.87.13","192.168.87.17","TCP","74","45110  >  80 [SYN] Seq=0 Win=64240 Len=0 MSS=1460 SACK_PERM TSval=3244791313 TSecr=0 WS=128"
"78","8.890262021","192.168.87.13","192.168.87.17","TCP","74","45124  >  80 [SYN] Seq=0 Win=64240 Len=0 MSS=1460 SACK_PERM TSval=3244791317 TSecr=0 WS=128"
"79","8.893821116","192.168.87.13","192.168.87.17","TCP","74","45126  >  80 [SYN] Seq=0 Win=64240 Len=0 MSS=1460 SACK_PERM TSval=3244791320 TSecr=0 WS=128"
"80","8.896540357","192.168.87.13","192.168.87.17","TCP","74","45142  >  80 [SYN] Seq=0 Win=64240 Len=0 MSS=1460 SACK_PERM TSval=3244791323 TSecr=0 WS=128"
"81","8.901288165","192.168.87.13","192.168.87.17","TCP","74","45152  >  80 [SYN] Seq=0 Win=64240 Len=0 MSS=1460 SACK_PERM TSval=3244791327 TSecr=0 WS=128"
"82","8.916116397","192.168.87.13","192.168.87.17","TCP","74","45160  >  80 [SYN] Seq=0 Win=64240 Len=0 MSS=1460 SACK_PERM TSval=3244791331 TSecr=0 WS=128"
"83","8.916116722","192.168.87.13","192.168.87.17","TCP","74","45164  >  80 [SYN] Seq=0 Win=64240 Len=0 MSS=1460 SACK_PERM TSval=3244791335 TSecr=0 WS=128"
"84","8.916116749","192.168.87.13","192.168.87.17","TCP","74","45178  >  80 [SYN] Seq=0 Win=64240 Len=0 MSS=1460 SACK_PERM TSval=3244791338 TSecr=0 WS=128"
"85","8.916116768","192.168.87.13","192.168.87.17","TCP","74","45192  >  80 [SYN] Seq=0 Win=64240 Len=0 MSS=1460 SACK_PERM TSval=3244791341 TSecr=0 WS=128"
"86","8.918022647","192.168.87.13","192.168.87.17","TCP","74","45194  >  80 [SYN] Seq=0 Win=64240 Len=0 MSS=1460 SACK_PERM TSval=3244791345 TSecr=0 WS=128"
"87","8.921487280","192.168.87.13","192.168.87.17","TCP","74","45200  >  80 [SYN] Seq=0 Win=64240 Len=0 MSS=1460 SACK_PERM TSval=3244791348 TSecr=0 WS=128"
"88","8.925255816","192.168.87.13","192.168.87.17","TCP","74","45212  >  80 [SYN] Seq=0 Win=64240 Len=0 MSS=1460 SACK_PERM TSval=3244791352 TSecr=0 WS=128"
"89","8.928241113","192.168.87.13","192.168.87.17","TCP","74","45216  >  80 [SYN] Seq=0 Win=64240 Len=0 MSS=1460 SACK_PERM TSval=3244791355 TSecr=0 WS=128"
"90","8.932063409","192.168.87.13","192.168.87.17","TCP","74","45218  >  80 [SYN] Seq=0 Win=64240 Len=0 MSS=1460 SACK_PERM TSval=3244791359 TSecr=0 WS=128"
"91","8.935186072","192.168.87.13","192.168.87.17","TCP","74","45224  >  80 [SYN] Seq=0 Win=64240 Len=0 MSS=1460 SACK_PERM TSval=3244791362 TSecr=0 WS=128"
"92","8.939554302","192.168.87.13","192.168.87.17","TCP","74","45228  >  80 [SYN] Seq=0 Win=64240 Len=0 MSS=1460 SACK_PERM TSval=3244791366 TSecr=0 WS=128"
"93","8.943080375","192.168.87.13","192.168.87.17","TCP","74","45236  >  80 [SYN] Seq=0 Win=64240 Len=0 MSS=1460 SACK_PERM TSval=3244791370 TSecr=0 WS=128"
"94","8.946646008","192.168.87.13","192.168.87.17","TCP","74","45250  >  80 [SYN] Seq=0 Win=64240 Len=0 MSS=1460 SACK_PERM TSval=3244791373 TSecr=0 WS=128"
"95","8.950379743","192.168.87.13","192.168.87.17","TCP","74","45258  >  80 [SYN] Seq=0 Win=64240 Len=0 MSS=1460 SACK_PERM TSval=3244791377 TSecr=0 WS=128"
"96","8.954173437","192.168.87.13","192.168.87.17","TCP","74","45262  >  80 [SYN] Seq=0 Win=64240 Len=0 MSS=1460 SACK_PERM TSval=3244791381 TSecr=0 WS=128"
"97","8.957099029","192.168.87.13","192.168.87.17","TCP","74","45278  >  80 [SYN] Seq=0 Win=64240 Len=0 MSS=1460 SACK_PERM TSval=3244791384 TSecr=0 WS=128"
"98","8.960829768","192.168.87.13","192.168.87.17","TCP","74","45284  >  80 [SYN] Seq=0 Win=64240 Len=0 MSS=1460 SACK_PERM TSval=3244791387 TSecr=0 WS=128"
"99","8.965087168","192.168.87.13","192.168.87.17","TCP","74","45290  >  80 [SYN] Seq=0 Win=64240 Len=0 MSS=1460 SACK_PERM TSval=3244791392 TSecr=0 WS=128"
"100","8.968821889","192.168.87.13","192.168.87.17","TCP","74","45304  >  80 [SYN] Seq=0 Win=64240 Len=0 MSS=1460 SACK_PERM TSval=3244791395 TSecr=0 WS=128"
"101","8.973418496","192.168.87.13","192.168.87.17","TCP","74","45306  >  80 [SYN] Seq=0 Win=64240 Len=0 MSS=1460 SACK_PERM TSval=3244791400 TSecr=0 WS=128"
"102","8.976336145","192.168.87.13","192.168.87.17","TCP","74","45316  >  80 [SYN] Seq=0 Win=64240 Len=0 MSS=1460 SACK_PERM TSval=3244791403 TSecr=0 WS=128"
"103","8.980988516","192.168.87.13","192.168.87.17","TCP","74","45326  >  80 [SYN] Seq=0 Win=64240 Len=0 MSS=1460 SACK_PERM TSval=3244791407 TSecr=0 WS=128"
"104","8.984982325","192.168.87.13","192.168.87.17","TCP","74","45336  >  80 [SYN] Seq=0 Win=64240 Len=0 MSS=1460 SACK_PERM TSval=3244791411 TSecr=0 WS=128"
"105","8.988146797","192.168.87.13","192.168.87.17","TCP","74","45340  >  80 [SYN] Seq=0 Win=64240 Len=0 MSS=1460 SACK_PERM TSval=3244791415 TSecr=0 WS=128"
"106","8.992132775","192.168.87.13","192.168.87.17","TCP","74","45352  >  80 [SYN] Seq=0 Win=64240 Len=0 MSS=1460 SACK_PERM TSval=3244791419 TSecr=0 WS=128"
"107","8.995420611","192.168.87.13","192.168.87.17","TCP","74","45358  >  80 [SYN] Seq=0 Win=64240 Len=0 MSS=1460 SACK_PERM TSval=3244791422 TSecr=0 WS=128"
"108","9.000017871","192.168.87.13","192.168.87.17","TCP","74","45374  >  80 [SYN] Seq=0 Win=64240 Len=0 MSS=1460 SACK_PERM TSval=3244791427 TSecr=0 WS=128"
"109","9.003024505","192.168.87.13","192.168.87.17","TCP","74","45382  >  80 [SYN] Seq=0 Win=64240 Len=0 MSS=1460 SACK_PERM TSval=3244791430 TSecr=0 WS=128"
"110","9.006045309","192.168.87.13","192.168.87.17","TCP","74","45388  >  80 [SYN] Seq=0 Win=64240 Len=0 MSS=1460 SACK_PERM TSval=3244791433 TSecr=0 WS=128"
"111","9.009099852","192.168.87.13","192.168.87.17","TCP","74","45398  >  80 [SYN] Seq=0 Win=64240 Len=0 MSS=1460 SACK_PERM TSval=3244791436 TSecr=0 WS=128"
"112","9.012170063","192.168.87.13","192.168.87.17","TCP","74","45410  >  80 [SYN] Seq=0 Win=64240 Len=0 MSS=1460 SACK_PERM TSval=3244791439 TSecr=0 WS=128"
"113","9.016062589","192.168.87.13","192.168.87.17","TCP","74","45414  >  80 [SYN] Seq=0 Win=64240 Len=0 MSS=1460 SACK_PERM TSval=3244791443 TSecr=0 WS=128"
"114","9.019850242","192.168.87.13","192.168.87.17","TCP","74","45428  >  80 [SYN] Seq=0 Win=64240 Len=0 MSS=1460 SACK_PERM TSval=3244791446 TSecr=0 WS=128"
"115","9.022797541","192.168.87.13","192.168.87.17","TCP","74","45440  >  80 [SYN] Seq=0 Win=64240 Len=0 MSS=1460 SACK_PERM TSval=3244791449 TSecr=0 WS=128"
"116","9.025425520","192.168.87.13","192.168.87.17","TCP","74","45448  >  80 [SYN] Seq=0 Win=64240 Len=0 MSS=1460 SACK_PERM TSval=3244791452 TSecr=0 WS=128"
"117","9.028415470","192.168.87.13","192.168.87.17","TCP","74","45462  >  80 [SYN] Seq=0 Win=64240 Len=0 MSS=1460 SACK_PERM TSval=3244791455 TSecr=0 WS=128"
"118","9.031430208","192.168.87.13","192.168.87.17","TCP","74","45470  >  80 [SYN] Seq=0 Win=64240 Len=0 MSS=1460 SACK_PERM TSval=3244791458 TSecr=0 WS=128"
"119","9.035162283","192.168.87.13","192.168.87.17","TCP","74","45484  >  80 [SYN] Seq=0 Win=64240 Len=0 MSS=1460 SACK_PERM TSval=3244791462 TSecr=0 WS=128"
"120","9.039070940","192.168.87.13","192.168.87.17","TCP","74","45496  >  80 [SYN] Seq=0 Win=64240 Len=0 MSS=1460 SACK_PERM TSval=3244791466 TSecr=0 WS=128"
"121","9.042036449","192.168.87.13","192.168.87.17","TCP","74","45512  >  80 [SYN] Seq=0 Win=64240 Len=0 MSS=1460 SACK_PERM TSval=3244791469 TSecr=0 WS=128"
"122","9.045289447","192.168.87.13","192.168.87.17","TCP","74","45520  >  80 [SYN] Seq=0 Win=64240 Len=0 MSS=1460 SACK_PERM TSval=3244791472 TSecr=0 WS=128"
"123","9.049027155","192.168.87.13","192.168.87.17","TCP","74","45522  >  80 [SYN] Seq=0 Win=64240 Len=0 MSS=1460 SACK_PERM TSval=3244791476 TSecr=0 WS=128"
"124","9.053425292","192.168.87.13","192.168.87.17","TCP","74","45524  >  80 [SYN] Seq=0 Win=64240 Len=0 MSS=1460 SACK_PERM TSval=3244791480 TSecr=0 WS=128"
"125","9.056506089","192.168.87.13","192.168.87.17","TCP","74","45530  >  80 [SYN] Seq=0 Win=64240 Len=0 MSS=1460 SACK_PERM TSval=3244791483 TSecr=0 WS=128"
"126","9.060044457","192.168.87.13","192.168.87.17","TCP","74","45544  >  80 [SYN] Seq=0 Win=64240 Len=0 MSS=1460 SACK_PERM TSval=3244791487 TSecr=0 WS=128"
"127","9.063062292","192.168.87.13","192.168.87.17","TCP","74","45548  >  80 [SYN] Seq=0 Win=64240 Len=0 MSS=1460 SACK_PERM TSval=3244791490 TSecr=0 WS=128"
"128","9.065975590","192.168.87.13","192.168.87.17","TCP","74","45556  >  80 [SYN] Seq=0 Win=64240 Len=0 MSS=1460 SACK_PERM TSval=3244791493 TSecr=0 WS=128"
"129","9.069037781","192.168.87.13","192.168.87.17","TCP","74","45560  >  80 [SYN] Seq=0 Win=64240 Len=0 MSS=1460 SACK_PERM TSval=3244791496 TSecr=0 WS=128"
"130","9.072073624","192.168.87.13","192.168.87.17","TCP","74","45564  >  80 [SYN] Seq=0 Win=64240 Len=0 MSS=1460 SACK_PERM TSval=3244791499 TSecr=0 WS=128"
"131","9.076204153","192.168.87.13","192.168.87.17","TCP","74","45578  >  80 [SYN] Seq=0 Win=64240 Len=0 MSS=1460 SACK_PERM TSval=3244791503 TSecr=0 WS=128"
"132","9.079982239","192.168.87.13","192.168.87.17","TCP","74","45584  >  80 [SYN] Seq=0 Win=64240 Len=0 MSS=1460 SACK_PERM TSval=3244791507 TSecr=0 WS=128"
"133","9.084068549","192.168.87.13","192.168.87.17","TCP","74","45590  >  80 [SYN] Seq=0 Win=64240 Len=0 MSS=1460 SACK_PERM TSval=3244791511 TSecr=0 WS=128"
"134","9.087459046","192.168.87.13","192.168.87.17","TCP","74","45602  >  80 [SYN] Seq=0 Win=64240 Len=0 MSS=1460 SACK_PERM TSval=3244791514 TSecr=0 WS=128"
"135","9.091857624","192.168.87.13","192.168.87.17","TCP","74","45608  >  80 [SYN] Seq=0 Win=64240 Len=0 MSS=1460 SACK_PERM TSval=3244791518 TSecr=0 WS=128"
"136","9.094345770","192.168.87.13","192.168.87.17","TCP","74","45614  >  80 [SYN] Seq=0 Win=64240 Len=0 MSS=1460 SACK_PERM TSval=3244791521 TSecr=0 WS=128"
"137","9.098797096","192.168.87.13","192.168.87.17","TCP","74","45630  >  80 [SYN] Seq=0 Win=64240 Len=0 MSS=1460 SACK_PERM TSval=3244791525 TSecr=0 WS=128"
"138","9.102014916","192.168.87.13","192.168.87.17","TCP","74","45638  >  80 [SYN] Seq=0 Win=64240 Len=0 MSS=1460 SACK_PERM TSval=3244791528 TSecr=0 WS=128"
"139","9.105299093","192.168.87.13","192.168.87.17","TCP","74","45648  >  80 [SYN] Seq=0 Win=64240 Len=0 MSS=1460 SACK_PERM TSval=3244791531 TSecr=0 WS=128"
"140","9.108230977","192.168.87.13","192.168.87.17","TCP","74","45656  >  80 [SYN] Seq=0 Win=64240 Len=0 MSS=1460 SACK_PERM TSval=3244791535 TSecr=0 WS=128"
"141","9.111945570","192.168.87.13","192.168.87.17","TCP","74","45662  >  80 [SYN] Seq=0 Win=64240 Len=0 MSS=1460 SACK_PERM TSval=3244791538 TSecr=0 WS=128"
"142","9.115613923","192.168.87.13","192.168.87.17","TCP","74","45668  >  80 [SYN] Seq=0 Win=64240 Len=0 MSS=1460 SACK_PERM TSval=3244791542 TSecr=0 WS=128"
"143","9.118846662","192.168.87.13","192.168.87.17","TCP","74","45672  >  80 [SYN] Seq=0 Win=64240 Len=0 MSS=1460 SACK_PERM TSval=3244791545 TSecr=0 WS=128"
"144","9.122064296","192.168.87.13","192.168.87.17","TCP","74","45676  >  80 [SYN] Seq=0 Win=64240 Len=0 MSS=1460 SACK_PERM TSval=3244791548 TSecr=0 WS=128"
"145","9.125931641","192.168.87.13","192.168.87.17","TCP","74","45680  >  80 [SYN] Seq=0 Win=64240 Len=0 MSS=1460 SACK_PERM TSval=3244791552 TSecr=0 WS=128"
"146","9.129083329","192.168.87.13","192.168.87.17","TCP","74","45688  >  80 [SYN] Seq=0 Win=64240 Len=0 MSS=1460 SACK_PERM TSval=3244791555 TSecr=0 WS=128"
"147","9.132987096","192.168.87.13","192.168.87.17","TCP","74","45692  >  80 [SYN] Seq=0 Win=64240 Len=0 MSS=1460 SACK_PERM TSval=3244791559 TSecr=0 WS=128"
"148","9.135863121","192.168.87.13","192.168.87.17","TCP","74","45704  >  80 [SYN] Seq=0 Win=64240 Len=0 MSS=1460 SACK_PERM TSval=3244791562 TSecr=0 WS=128"
"149","9.139771445","192.168.87.13","192.168.87.17","TCP","74","45718  >  80 [SYN] Seq=0 Win=64240 Len=0 MSS=1460 SACK_PERM TSval=3244791566 TSecr=0 WS=128"
"150","9.143023343","192.168.87.13","192.168.87.17","TCP","74","45730  >  80 [SYN] Seq=0 Win=64240 Len=0 MSS=1460 SACK_PERM TSval=3244791569 TSecr=0 WS=128"
"151","9.147335600","192.168.87.13","192.168.87.17","TCP","74","45744  >  80 [SYN] Seq=0 Win=64240 Len=0 MSS=1460 SACK_PERM TSval=3244791573 TSecr=0 WS=128"
"152","9.150315233","192.168.87.13","192.168.87.17","TCP","74","45756  >  80 [SYN] Seq=0 Win=64240 Len=0 MSS=1460 SACK_PERM TSval=3244791577 TSecr=0 WS=128"
"153","9.153280572","192.168.87.13","192.168.87.17","TCP","74","45758  >  80 [SYN] Seq=0 Win=64240 Len=0 MSS=1460 SACK_PERM TSval=3244791580 TSecr=0 WS=128"
"154","9.157777477","192.168.87.13","192.168.87.17","TCP","74","45768  >  80 [SYN] Seq=0 Win=64240 Len=0 MSS=1460 SACK_PERM TSval=3244791584 TSecr=0 WS=128"
"155","9.161053934","192.168.87.13","192.168.87.17","TCP","74","45770  >  80 [SYN] Seq=0 Win=64240 Len=0 MSS=1460 SACK_PERM TSval=3244791587 TSecr=0 WS=128"
"156","9.164975623","192.168.87.13","192.168.87.17","TCP","74","45784  >  80 [SYN] Seq=0 Win=64240 Len=0 MSS=1460 SACK_PERM TSval=3244791591 TSecr=0 WS=128"
"157","9.168018207","192.168.87.13","192.168.87.17","TCP","74","45786  >  80 [SYN] Seq=0 Win=64240 Len=0 MSS=1460 SACK_PERM TSval=3244791595 TSecr=0 WS=128"
"158","9.171012734","192.168.87.13","192.168.87.17","TCP","74","45798  >  80 [SYN] Seq=0 Win=64240 Len=0 MSS=1460 SACK_PERM TSval=3244791597 TSecr=0 WS=128"
"159","9.174005029","192.168.87.13","192.168.87.17","TCP","74","45802  >  80 [SYN] Seq=0 Win=64240 Len=0 MSS=1460 SACK_PERM TSval=3244791600 TSecr=0 WS=128"
"160","9.176973009","192.168.87.13","192.168.87.17","TCP","74","45812  >  80 [SYN] Seq=0 Win=64240 Len=0 MSS=1460 SACK_PERM TSval=3244791603 TSecr=0 WS=128"
"161","9.180038624","192.168.87.13","192.168.87.17","TCP","74","45822  >  80 [SYN] Seq=0 Win=64240 Len=0 MSS=1460 SACK_PERM TSval=3244791606 TSecr=0 WS=128"
"162","9.184247726","192.168.87.13","192.168.87.17","TCP","74","45832  >  80 [SYN] Seq=0 Win=64240 Len=0 MSS=1460 SACK_PERM TSval=3244791610 TSecr=0 WS=128"
"163","9.186197306","192.168.87.13","192.168.87.17","TCP","74","45842  >  80 [SYN] Seq=0 Win=64240 Len=0 MSS=1460 SACK_PERM TSval=3244791613 TSecr=0 WS=128"
"164","9.189168491","192.168.87.13","192.168.87.17","TCP","74","45856  >  80 [SYN] Seq=0 Win=64240 Len=0 MSS=1460 SACK_PERM TSval=3244791616 TSecr=0 WS=128"
"165","9.193119865","192.168.87.13","192.168.87.17","TCP","74","45868  >  80 [SYN] Seq=0 Win=64240 Len=0 MSS=1460 SACK_PERM TSval=3244791619 TSecr=0 WS=128"
"166","9.195050069","192.168.87.13","192.168.87.17","TCP","74","45882  >  80 [SYN] Seq=0 Win=64240 Len=0 MSS=1460 SACK_PERM TSval=3244791622 TSecr=0 WS=128"
"167","9.198290180","192.168.87.13","192.168.87.17","TCP","74","45896  >  80 [SYN] Seq=0 Win=64240 Len=0 MSS=1460 SACK_PERM TSval=3244791625 TSecr=0 WS=128"
"168","9.201819919","192.168.87.13","192.168.87.17","TCP","74","45900  >  80 [SYN] Seq=0 Win=64240 Len=0 MSS=1460 SACK_PERM TSval=3244791628 TSecr=0 WS=128"
"169","9.204060524","192.168.87.13","192.168.87.17","TCP","74","45914  >  80 [SYN] Seq=0 Win=64240 Len=0 MSS=1460 SACK_PERM TSval=3244791631 TSecr=0 WS=128"
"170","9.207980615","192.168.87.13","192.168.87.17","TCP","74","45924  >  80 [SYN] Seq=0 Win=64240 Len=0 MSS=1460 SACK_PERM TSval=3244791634 TSecr=0 WS=128"
"171","9.211213700","192.168.87.13","192.168.87.17","TCP","74","45942  >  80 [SYN] Seq=0 Win=64240 Len=0 MSS=1460 SACK_PERM TSval=3244791638 TSecr=0 WS=128"
"172","9.213922759","192.168.87.13","192.168.87.17","TCP","74","45944  >  80 [SYN] Seq=0 Win=64240 Len=0 MSS=1460 SACK_PERM TSval=3244791640 TSecr=0 WS=128"
"173","9.216411727","192.168.87.13","192.168.87.17","TCP","74","45950  >  80 [SYN] Seq=0 Win=64240 Len=0 MSS=1460 SACK_PERM TSval=3244791643 TSecr=0 WS=128"
"174","9.220992864","192.168.87.13","192.168.87.17","TCP","74","45966  >  80 [SYN] Seq=0 Win=64240 Len=0 MSS=1460 SACK_PERM TSval=3244791647 TSecr=0 WS=128"
"175","9.224104063","192.168.87.13","192.168.87.17","TCP","74","45980  >  80 [SYN] Seq=0 Win=64240 Len=0 MSS=1460 SACK_PERM TSval=3244791651 TSecr=0 WS=128"
"176","9.227276998","192.168.87.13","192.168.87.17","TCP","74","45992  >  80 [SYN] Seq=0 Win=64240 Len=0 MSS=1460 SACK_PERM TSval=3244791654 TSecr=0 WS=128"
"177","9.230806323","192.168.87.13","192.168.87.17","TCP","74","45994  >  80 [SYN] Seq=0 Win=64240 Len=0 MSS=1460 SACK_PERM TSval=3244791657 TSecr=0 WS=128"
"178","9.234383250","192.168.87.13","192.168.87.17","TCP","74","46012  >  80 [SYN] Seq=0 Win=64240 Len=0 MSS=1460 SACK_PERM TSval=3244791661 TSecr=0 WS=128"
"179","9.238741728","192.168.87.13","192.168.87.17","TCP","74","46026  >  80 [SYN] Seq=0 Win=64240 Len=0 MSS=1460 SACK_PERM TSval=3244791665 TSecr=0 WS=128"
"180","9.241423512","192.168.87.13","192.168.87.17","TCP","74","46036  >  80 [SYN] Seq=0 Win=64240 Len=0 MSS=1460 SACK_PERM TSval=3244791668 TSecr=0 WS=128"
"181","9.244785601","192.168.87.13","192.168.87.17","TCP","74","46052  >  80 [SYN] Seq=0 Win=64240 Len=0 MSS=1460 SACK_PERM TSval=3244791671 TSecr=0 WS=128"
"182","9.248300068","192.168.87.13","192.168.87.17","TCP","74","46066  >  80 [SYN] Seq=0 Win=64240 Len=0 MSS=1460 SACK_PERM TSval=3244791675 TSecr=0 WS=128"
"183","9.252028596","192.168.87.13","192.168.87.17","TCP","74","46068  >  80 [SYN] Seq=0 Win=64240 Len=0 MSS=1460 SACK_PERM TSval=3244791678 TSecr=0 WS=128"
"184","9.255037380","192.168.87.13","192.168.87.17","TCP","74","46070  >  80 [SYN] Seq=0 Win=64240 Len=0 MSS=1460 SACK_PERM TSval=3244791681 TSecr=0 WS=128"
"185","9.258136154","192.168.87.13","192.168.87.17","TCP","74","46080  >  80 [SYN] Seq=0 Win=64240 Len=0 MSS=1460 SACK_PERM TSval=3244791685 TSecr=0 WS=128"
"186","9.261004497","192.168.87.13","192.168.87.17","TCP","74","46094  >  80 [SYN] Seq=0 Win=64240 Len=0 MSS=1460 SACK_PERM TSval=3244791688 TSecr=0 WS=128"
"187","9.265922755","192.168.87.13","192.168.87.17","TCP","74","46110  >  80 [SYN] Seq=0 Win=64240 Len=0 MSS=1460 SACK_PERM TSval=3244791691 TSecr=0 WS=128"
"188","9.268145814","192.168.87.13","192.168.87.17","TCP","74","46122  >  80 [SYN] Seq=0 Win=64240 Len=0 MSS=1460 SACK_PERM TSval=3244791694 TSecr=0 WS=128"
"189","9.270883795","192.168.87.13","192.168.87.17","TCP","74","46130  >  80 [SYN] Seq=0 Win=64240 Len=0 MSS=1460 SACK_PERM TSval=3244791697 TSecr=0 WS=128"
"190","9.274844023","192.168.87.13","192.168.87.17","TCP","74","46138  >  80 [SYN] Seq=0 Win=64240 Len=0 MSS=1460 SACK_PERM TSval=3244791701 TSecr=0 WS=128"
"191","9.278152936","192.168.87.13","192.168.87.17","TCP","74","46152  >  80 [SYN] Seq=0 Win=64240 Len=0 MSS=1460 SACK_PERM TSval=3244791705 TSecr=0 WS=128"
"192","9.281101360","192.168.87.13","192.168.87.17","TCP","74","46160  >  80 [SYN] Seq=0 Win=64240 Len=0 MSS=1460 SACK_PERM TSval=3244791708 TSecr=0 WS=128"
"193","9.284065533","192.168.87.13","192.168.87.17","TCP","74","46164  >  80 [SYN] Seq=0 Win=64240 Len=0 MSS=1460 SACK_PERM TSval=3244791711 TSecr=0 WS=128"
"194","9.289021972","192.168.87.13","192.168.87.17","TCP","74","46170  >  80 [SYN] Seq=0 Win=64240 Len=0 MSS=1460 SACK_PERM TSval=3244791715 TSecr=0 WS=128"
"195","9.292074575","192.168.87.13","192.168.87.17","TCP","74","46182  >  80 [SYN] Seq=0 Win=64240 Len=0 MSS=1460 SACK_PERM TSval=3244791718 TSecr=0 WS=128"
"196","9.295201435","192.168.87.13","192.168.87.17","TCP","74","46196  >  80 [SYN] Seq=0 Win=64240 Len=0 MSS=1460 SACK_PERM TSval=3244791722 TSecr=0 WS=128"
"197","9.299056698","192.168.87.13","192.168.87.17","TCP","74","46206  >  80 [SYN] Seq=0 Win=64240 Len=0 MSS=1460 SACK_PERM TSval=3244791726 TSecr=0 WS=128"
"198","9.301985587","192.168.87.13","192.168.87.17","TCP","74","46210  >  80 [SYN] Seq=0 Win=64240 Len=0 MSS=1460 SACK_PERM TSval=3244791728 TSecr=0 WS=128"
"199","9.305995282","192.168.87.13","192.168.87.17","TCP","74","46214  >  80 [SYN] Seq=0 Win=64240 Len=0 MSS=1460 SACK_PERM TSval=3244791732 TSecr=0 WS=128"
"200","9.310821938","192.168.87.13","192.168.87.17","TCP","74","46216  >  80 [SYN] Seq=0 Win=64240 Len=0 MSS=1460 SACK_PERM TSval=3244791736 TSecr=0 WS=128"
"201","9.312260495","192.168.87.13","192.168.87.17","TCP","74","46226  >  80 [SYN] Seq=0 Win=64240 Len=0 MSS=1460 SACK_PERM TSval=3244791739 TSecr=0 WS=128"
"202","9.317095562","192.168.87.13","192.168.87.17","TCP","74","46244  >  80 [SYN] Seq=0 Win=64240 Len=0 MSS=1460 SACK_PERM TSval=3244791743 TSecr=0 WS=128"
"203","9.320259406","192.168.87.13","192.168.87.17","TCP","74","46256  >  80 [SYN] Seq=0 Win=64240 Len=0 MSS=1460 SACK_PERM TSval=3244791747 TSecr=0 WS=128"
"204","9.323387970","192.168.87.13","192.168.87.17","TCP","74","46268  >  80 [SYN] Seq=0 Win=64240 Len=0 MSS=1460 SACK_PERM TSval=3244791750 TSecr=0 WS=128"
"205","9.326370879","192.168.87.13","192.168.87.17","TCP","74","46278  >  80 [SYN] Seq=0 Win=64240 Len=0 MSS=1460 SACK_PERM TSval=3244791753 TSecr=0 WS=128"
"206","9.329810478","192.168.87.13","192.168.87.17","TCP","74","46280  >  80 [SYN] Seq=0 Win=64240 Len=0 MSS=1460 SACK_PERM TSval=3244791756 TSecr=0 WS=128"
"207","9.332841559","192.168.87.13","192.168.87.17","TCP","74","46296  >  80 [SYN] Seq=0 Win=64240 Len=0 MSS=1460 SACK_PERM TSval=3244791759 TSecr=0 WS=128"
"208","9.335812996","192.168.87.13","192.168.87.17","TCP","74","46306  >  80 [SYN] Seq=0 Win=64240 Len=0 MSS=1460 SACK_PERM TSval=3244791762 TSecr=0 WS=128"
"209","9.339344630","192.168.87.13","192.168.87.17","TCP","74","46320  >  80 [SYN] Seq=0 Win=64240 Len=0 MSS=1460 SACK_PERM TSval=3244791766 TSecr=0 WS=128"
"210","9.342194384","192.168.87.13","192.168.87.17","TCP","74","46332  >  80 [SYN] Seq=0 Win=64240 Len=0 MSS=1460 SACK_PERM TSval=3244791769 TSecr=0 WS=128"
"211","9.345753975","192.168.87.13","192.168.87.17","TCP","74","46344  >  80 [SYN] Seq=0 Win=64240 Len=0 MSS=1460 SACK_PERM TSval=3244791772 TSecr=0 WS=128"
"212","9.349109273","192.168.87.13","192.168.87.17","TCP","74","46346  >  80 [SYN] Seq=0 Win=64240 Len=0 MSS=1460 SACK_PERM TSval=3244791776 TSecr=0 WS=128"
"213","9.352040075","192.168.87.13","192.168.87.17","TCP","74","46362  >  80 [SYN] Seq=0 Win=64240 Len=0 MSS=1460 SACK_PERM TSval=3244791779 TSecr=0 WS=128"
"214","9.355933356","192.168.87.13","192.168.87.17","TCP","74","46366  >  80 [SYN] Seq=0 Win=64240 Len=0 MSS=1460 SACK_PERM TSval=3244791782 TSecr=0 WS=128"
"215","9.359093199","192.168.87.13","192.168.87.17","TCP","74","46372  >  80 [SYN] Seq=0 Win=64240 Len=0 MSS=1460 SACK_PERM TSval=3244791786 TSecr=0 WS=128"
"216","9.362103581","192.168.87.13","192.168.87.17","TCP","74","46380  >  80 [SYN] Seq=0 Win=64240 Len=0 MSS=1460 SACK_PERM TSval=3244791788 TSecr=0 WS=128"
"217","9.364908500","192.168.87.13","192.168.87.17","TCP","74","46394  >  80 [SYN] Seq=0 Win=64240 Len=0 MSS=1460 SACK_PERM TSval=3244791791 TSecr=0 WS=128"
"218","9.379505064","192.168.87.13","192.168.87.17","TCP","74","46396  >  80 [SYN] Seq=0 Win=64240 Len=0 MSS=1460 SACK_PERM TSval=3244791794 TSecr=0 WS=128"
"219","9.379505269","192.168.87.13","192.168.87.17","TCP","74","46406  >  80 [SYN] Seq=0 Win=64240 Len=0 MSS=1460 SACK_PERM TSval=3244791797 TSecr=0 WS=128"
"220","9.379505308","192.168.87.13","192.168.87.17","TCP","74","46412  >  80 [SYN] Seq=0 Win=64240 Len=0 MSS=1460 SACK_PERM TSval=3244791800 TSecr=0 WS=128"
"221","9.379505340","192.168.87.13","192.168.87.17","TCP","74","46420  >  80 [SYN] Seq=0 Win=64240 Len=0 MSS=1460 SACK_PERM TSval=3244791804 TSecr=0 WS=128"
"222","9.382906151","192.168.87.13","192.168.87.17","TCP","74","46428  >  80 [SYN] Seq=0 Win=64240 Len=0 MSS=1460 SACK_PERM TSval=3244791807 TSecr=0 WS=128"
"223","9.383481787","192.168.87.13","192.168.87.17","TCP","74","46430  >  80 [SYN] Seq=0 Win=64240 Len=0 MSS=1460 SACK_PERM TSval=3244791810 TSecr=0 WS=128"
"224","9.387825177","192.168.87.13","192.168.87.17","TCP","74","46442  >  80 [SYN] Seq=0 Win=64240 Len=0 MSS=1460 SACK_PERM TSval=3244791814 TSecr=0 WS=128"
"225","9.390959907","192.168.87.13","192.168.87.17","TCP","74","46444  >  80 [SYN] Seq=0 Win=64240 Len=0 MSS=1460 SACK_PERM TSval=3244791817 TSecr=0 WS=128"
"226","9.393891437","192.168.87.13","192.168.87.17","TCP","74","46446  >  80 [SYN] Seq=0 Win=64240 Len=0 MSS=1460 SACK_PERM TSval=3244791820 TSecr=0 WS=128"
"227","9.396256498","192.168.87.13","192.168.87.17","TCP","74","46460  >  80 [SYN] Seq=0 Win=64240 Len=0 MSS=1460 SACK_PERM TSval=3244791823 TSecr=0 WS=128"
"228","9.400063678","192.168.87.13","192.168.87.17","TCP","74","46466  >  80 [SYN] Seq=0 Win=64240 Len=0 MSS=1460 SACK_PERM TSval=3244791826 TSecr=0 WS=128"
"229","9.402899546","192.168.87.13","192.168.87.17","TCP","74","46478  >  80 [SYN] Seq=0 Win=64240 Len=0 MSS=1460 SACK_PERM TSval=3244791829 TSecr=0 WS=128"
"230","9.405194600","192.168.87.13","192.168.87.17","TCP","74","46480  >  80 [SYN] Seq=0 Win=64240 Len=0 MSS=1460 SACK_PERM TSval=3244791832 TSecr=0 WS=128"
"231","9.408809650","192.168.87.13","192.168.87.17","TCP","74","46494  >  80 [SYN] Seq=0 Win=64240 Len=0 MSS=1460 SACK_PERM TSval=3244791835 TSecr=0 WS=128"
"232","9.412053693","192.168.87.13","192.168.87.17","TCP","74","46514  >  80 [SYN] Seq=0 Win=64240 Len=0 MSS=1460 SACK_PERM TSval=3244791838 TSecr=0 WS=128"
"233","9.415013085","192.168.87.13","192.168.87.17","TCP","74","46524  >  80 [SYN] Seq=0 Win=64240 Len=0 MSS=1460 SACK_PERM TSval=3244791842 TSecr=0 WS=128"
"234","9.417780844","192.168.87.13","192.168.87.17","TCP","74","46534  >  80 [SYN] Seq=0 Win=64240 Len=0 MSS=1460 SACK_PERM TSval=3244791844 TSecr=0 WS=128"
"235","9.421050914","192.168.87.13","192.168.87.17","TCP","74","46536  >  80 [SYN] Seq=0 Win=64240 Len=0 MSS=1460 SACK_PERM TSval=3244791848 TSecr=0 WS=128"
"236","9.424040659","192.168.87.13","192.168.87.17","TCP","74","46538  >  80 [SYN] Seq=0 Win=64240 Len=0 MSS=1460 SACK_PERM TSval=3244791851 TSecr=0 WS=128"
"237","9.428006980","192.168.87.13","192.168.87.17","TCP","74","46546  >  80 [SYN] Seq=0 Win=64240 Len=0 MSS=1460 SACK_PERM TSval=3244791854 TSecr=0 WS=128"
"238","9.430997004","192.168.87.13","192.168.87.17","TCP","74","46548  >  80 [SYN] Seq=0 Win=64240 Len=0 MSS=1460 SACK_PERM TSval=3244791857 TSecr=0 WS=128"
"239","9.434353072","192.168.87.13","192.168.87.17","TCP","74","46556  >  80 [SYN] Seq=0 Win=64240 Len=0 MSS=1460 SACK_PERM TSval=3244791861 TSecr=0 WS=128"
"240","9.438795891","192.168.87.13","192.168.87.17","TCP","74","46564  >  80 [SYN] Seq=0 Win=64240 Len=0 MSS=1460 SACK_PERM TSval=3244791865 TSecr=0 WS=128"
"241","9.444784928","192.168.87.13","192.168.87.17","TCP","74","46568  >  80 [SYN] Seq=0 Win=64240 Len=0 MSS=1460 SACK_PERM TSval=3244791868 TSecr=0 WS=128"
"242","9.445338323","192.168.87.13","192.168.87.17","TCP","74","46578  >  80 [SYN] Seq=0 Win=64240 Len=0 MSS=1460 SACK_PERM TSval=3244791871 TSecr=0 WS=128"
"243","9.449519647","192.168.87.13","192.168.87.17","TCP","74","46582  >  80 [SYN] Seq=0 Win=64240 Len=0 MSS=1460 SACK_PERM TSval=3244791876 TSecr=0 WS=128"
"244","9.452781058","192.168.87.13","192.168.87.17","TCP","74","46592  >  80 [SYN] Seq=0 Win=64240 Len=0 MSS=1460 SACK_PERM TSval=3244791879 TSecr=0 WS=128"
"245","9.455865241","192.168.87.13","192.168.87.17","TCP","74","46594  >  80 [SYN] Seq=0 Win=64240 Len=0 MSS=1460 SACK_PERM TSval=3244791882 TSecr=0 WS=128"
"246","9.458792915","192.168.87.13","192.168.87.17","TCP","74","46608  >  80 [SYN] Seq=0 Win=64240 Len=0 MSS=1460 SACK_PERM TSval=3244791885 TSecr=0 WS=128"
"247","9.461934262","192.168.87.13","192.168.87.17","TCP","74","46622  >  80 [SYN] Seq=0 Win=64240 Len=0 MSS=1460 SACK_PERM TSval=3244791888 TSecr=0 WS=128"
"248","9.464961551","192.168.87.13","192.168.87.17","TCP","74","46640  >  80 [SYN] Seq=0 Win=64240 Len=0 MSS=1460 SACK_PERM TSval=3244791891 TSecr=0 WS=128"
"249","9.467988191","192.168.87.13","192.168.87.17","TCP","74","46648  >  80 [SYN] Seq=0 Win=64240 Len=0 MSS=1460 SACK_PERM TSval=3244791894 TSecr=0 WS=128"
"250","9.470807286","192.168.87.13","192.168.87.17","TCP","74","46662  >  80 [SYN] Seq=0 Win=64240 Len=0 MSS=1460 SACK_PERM TSval=3244791897 TSecr=0 WS=128"
"251","9.473778528","192.168.87.13","192.168.87.17","TCP","74","46668  >  80 [SYN] Seq=0 Win=64240 Len=0 MSS=1460 SACK_PERM TSval=3244791900 TSecr=0 WS=128"
"252","9.478018954","192.168.87.13","192.168.87.17","TCP","74","46684  >  80 [SYN] Seq=0 Win=64240 Len=0 MSS=1460 SACK_PERM TSval=3244791904 TSecr=0 WS=128"
"253","9.482024709","192.168.87.13","192.168.87.17","TCP","74","46698  >  80 [SYN] Seq=0 Win=64240 Len=0 MSS=1460 SACK_PERM TSval=3244791908 TSecr=0 WS=128"
"254","9.485261433","192.168.87.13","192.168.87.17","TCP","74","46706  >  80 [SYN] Seq=0 Win=64240 Len=0 MSS=1460 SACK_PERM TSval=3244791912 TSecr=0 WS=128"
"255","9.489066068","192.168.87.13","192.168.87.17","TCP","74","46712  >  80 [SYN] Seq=0 Win=64240 Len=0 MSS=1460 SACK_PERM TSval=3244791916 TSecr=0 WS=128"
"256","9.492962111","192.168.87.13","192.168.87.17","TCP","74","46720  >  80 [SYN] Seq=0 Win=64240 Len=0 MSS=1460 SACK_PERM TSval=3244791919 TSecr=0 WS=128"
"257","9.496060289","192.168.87.13","192.168.87.17","TCP","74","46736  >  80 [SYN] Seq=0 Win=64240 Len=0 MSS=1460 SACK_PERM TSval=3244791922 TSecr=0 WS=128"
"258","9.498926595","192.168.87.13","192.168.87.17","TCP","74","46748  >  80 [SYN] Seq=0 Win=64240 Len=0 MSS=1460 SACK_PERM TSval=3244791925 TSecr=0 WS=128"
"259","9.501417815","192.168.87.13","192.168.87.17","TCP","74","46760  >  80 [SYN] Seq=0 Win=64240 Len=0 MSS=1460 SACK_PERM TSval=3244791928 TSecr=0 WS=128"
